<?xml version="1.0" encoding="UTF-8" standalone="no"?><gems xmlns="http://www.example.org/gems" xmlns:xsi="http://www.w3.org/2001/XMLSchema-instance" xsi:schemaLocation="http://www.example.org/gems gems.xsd"><natural-gem id="g1" weight="5"><extraction-place>AFRICA</extraction-place><name>Diamond</name><preciousness>PRECIOUS</preciousness><visual-parameters><color>Yellow</color><transparency>80</transparency><edge-amount>4</edge-amount></visual-parameters><creation-date>2021-03</creation-date></natural-gem><natural-gem id="g2" weight="0"><extraction-place>ASIA</extraction-place><name>Ruby</name><preciousness>PRECIOUS</preciousness><visual-parameters><color>Red</color><transparency>90</transparency><edge-amount>13</edge-amount></visual-parameters><creation-date>2020-12</creation-date></natural-gem><natural-gem id="g3" weight="0"><extraction-place>NORTH_AMERICA</extraction-place><name>Sapphire</name><preciousness>PRECIOUS</preciousness><visual-parameters><color>Blue</color><transparency>65</transparency><edge-amount>15</edge-amount></visual-parameters><creation-date>2020-08</creation-date></natural-gem><natural-gem id="g7" weight="0"><extraction-place>AFRICA</extraction-place><name>Topaz</name><preciousness>PRECIOUS</preciousness><visual-parameters><color>Pale blue</color><transparency>75</transparency><edge-amount>12</edge-amount></visual-parameters><creation-date>2002-10</creation-date></natural-gem><natural-gem id="g8" weight="0"><extraction-place>NORTH_AMERICA</extraction-place><name>Citrine</name><preciousness>SEMIPRECIOUS</preciousness><visual-parameters><color>White</color><transparency>96</transparency><edge-amount>8</edge-amount></visual-parameters><creation-date>1973-10</creation-date></natural-gem><natural-gem id="g11" weight="0"><extraction-place>SIBERIA</extraction-place><name>Heliodor</name><preciousness>SEMIPRECIOUS</preciousness><visual-parameters><color>Golden yellow</color><transparency>59</transparency><edge-amount>13</edge-amount></visual-parameters><creation-date>1987-11</creation-date></natural-gem><natural-gem id="g12" weight="0"><extraction-place>SIBERIA</extraction-place><name>Opal</name><preciousness>SEMIPRECIOUS</preciousness><visual-parameters><color>Orange</color><transparency>57</transparency><edge-amount>8</edge-amount></visual-parameters><creation-date>1989-03</creation-date></natural-gem><natural-gem id="g13" weight="0"><extraction-place>AFRICA</extraction-place><name>Andalusite</name><preciousness>SEMIPRECIOUS</preciousness><visual-parameters><color>Grey</color><transparency>86</transparency><edge-amount>5</edge-amount></visual-parameters><creation-date>2005-04</creation-date></natural-gem><artificial-gem id="g4" weight="8"><growing-time>500</growing-time><name>Artificial Diamond</name><preciousness>PRECIOUS</preciousness><visual-parameters><color>Blue</color><transparency>97</transparency><edge-amount>4</edge-amount></visual-parameters><creation-date>2018-06</creation-date></artificial-gem><artificial-gem id="g5" weight="0"><growing-time>900</growing-time><name>Artificial Ruby</name><preciousness>PRECIOUS</preciousness><visual-parameters><color>Burgundy</color><transparency>76</transparency><edge-amount>12</edge-amount></visual-parameters><creation-date>2002-03</creation-date></artificial-gem><artificial-gem id="g6" weight="2"><growing-time>480</growing-time><name>Artificial Sapphire</name><preciousness>PRECIOUS</preciousness><visual-parameters><color>Grey</color><transparency>92</transparency><edge-amount>14</edge-amount></visual-parameters><creation-date>1978-07</creation-date></artificial-gem><artificial-gem id="g9" weight="0"><growing-time>527</growing-time><name>Artificial Tanzanite</name><preciousness>PRECIOUS</preciousness><visual-parameters><color>Blue</color><transparency>99</transparency><edge-amount>6</edge-amount></visual-parameters><creation-date>1923-10</creation-date></artificial-gem><artificial-gem id="g10" weight="0"><growing-time>784</growing-time><name>Artificial Aquamarine</name><preciousness>PRECIOUS</preciousness><visual-parameters><color>Greenish blue</color><transparency>68</transparency><edge-amount>13</edge-amount></visual-parameters><creation-date>1968-06</creation-date></artificial-gem><artificial-gem id="g14" weight="0"><growing-time>368</growing-time><name>Artificial Tourmaline</name><preciousness>SEMIPRECIOUS</preciousness><visual-parameters><color>Brown</color><transparency>75</transparency><edge-amount>15</edge-amount></visual-parameters><creation-date>1965-02</creation-date></artificial-gem><artificial-gem id="g15" weight="0"><growing-time>459</growing-time><name>Demantoid</name><preciousness>SEMIPRECIOUS</preciousness><visual-parameters><color>Green</color><transparency>35</transparency><edge-amount>4</edge-amount></visual-parameters><creation-date>2001-03</creation-date></artificial-gem><artificial-gem id="g16" weight="0"><growing-time>759</growing-time><name>Artificial Tsavorite</name><preciousness>SEMIPRECIOUS</preciousness><visual-parameters><color>Dark green</color><transparency>26</transparency><edge-amount>9</edge-amount></visual-parameters><creation-date>1999-05</creation-date></artificial-gem></gems>